{
  "$schema": "https://json-schema.org/draft/2020-12/schema",
  "$id": "urn:sbf:feature-contract:1",
  "title": "backend-skeleton per-feature contract (meta-schema)",
  "description": "Validates the SHAPE of specs/<feature_id>/contracts/<feature_id>.schema.json itself -- not a payload. See contracts/validate.mjs for payload validation against a specific operation inside a contract that already passed this meta-schema.",
  "type": "object",
  "additionalProperties": false,
  "required": ["sbf_contract", "feature_id", "feature_uid", "source", "operations", "warnings", "completeness"],
  "properties": {
    "sbf_contract": { "const": "9" },
    "feature_id": { "type": "string", "pattern": "^[0-9]{3}-[a-z0-9]+(-[a-z0-9]+)*$" },
    "feature_uid": { "type": "string", "format": "uuid" },
    "source": {
      "type": "object",
      "required": ["adapter", "module", "provenance"],
      "properties": {
        "adapter": { "type": ["string", "null"] },
        "module": { "type": ["string", "null"] },
        "provenance": { "type": "string" }
      }
    },
    "sourceSecuritySchemes": {
      "description": "A7: components.securitySchemes entries copied verbatim from a real source document (--openapi-file), restricted to schemes actually referenced by at least one operation's copied sourceSecurity requirement anywhere in this contract. Omitted entirely when openapi reconciliation never resolved any security requirement.",
      "type": "object"
    },
    "operations": {
      "type": "object",
      "additionalProperties": {
        "type": "object",
        "additionalProperties": false,
        "required": ["verb", "path", "pathParams", "body", "provenance"],
        "properties": {
          "verb": { "type": "string" },
          "path": { "type": "string" },
          "pathParams": { "type": "object" },
          "body": { "enum": [true, false, "unknown"] },
          "provenance": { "type": "string" },
          "requestBodySchema": {
            "description": "A2: the operation's request body projected from a real OpenAPI 3.1 document -- see contracts/openapi.mjs's inlineSchema(). Fully inlined (no $ref) EXCEPT at a genuinely self-referential component (D-openapi-cyclic-refs), where a $ref/$defs pair is used instead -- see this schema's own top-level $defs when present. Present only when reconciliation matched/adopted this operation AND its application/json schema resolved; omitted otherwise. Not deeply validated as 'is this a valid JSON Schema' here -- that would need a schema-of-schemas, out of scope.",
            "type": "object"
          },
          "requestBodyRequired": { "type": "boolean" },
          "responseSchema": {
            "description": "A3: all documented 2xx application/json response schemas for this operation, fully inlined (no $ref) EXCEPT at a genuinely self-referential component (D-openapi-cyclic-refs, $ref/$defs used instead); an anyOf union when 2+ distinct shapes are documented. Present only when matched/adopted AND at least one resolved.",
            "type": "object"
          },
          "errorSchema": {
            "description": "A3: all documented 4xx/5xx application/json response schemas for this operation, fully inlined (no $ref) EXCEPT at a genuinely self-referential component (D-openapi-cyclic-refs, $ref/$defs used instead); an anyOf union when 2+ distinct shapes are documented. Present only when matched/adopted AND at least one resolved.",
            "type": "object"
          },
          "sourceParameters": {
            "description": "A7: non-path (query/header/cookie) parameters copied verbatim from a real source document's operation.parameters[], with `schema` resolved through inlineSchema(). Present only when matched/adopted AND the source document declared at least one such parameter that could be copied (a parameter whose own schema failed to resolve is still included here, just without a `schema` key).",
            "type": "array",
            "items": { "type": "object" }
          },
          "sourceSecurity": {
            "description": "A7: the operation's OpenAPI Security Requirement array, copied verbatim from the source document -- including a literal [] (a genuine positive claim of 'no auth required'). Present only when the source document declared `security` for this exact operation AND every scheme it names resolved against components.securitySchemes.",
            "type": "array",
            "items": { "type": "object" }
          },
          "sourceSummary": {
            "description": "A7: the operation's `summary` string, copied verbatim from the source document. Present only when the source document set one -- never synthesized from operationId or module names.",
            "type": "string"
          },
          "sourceTags": {
            "description": "A7: the operation's `tags` array, copied verbatim from the source document. Present only when the source document set at least one.",
            "type": "array",
            "items": { "type": "string" }
          },
          "sourceResponses": {
            "description": "A8: per-status HTTP responses copied from a real source document, keyed by the document's own literal status key (a literal code, a range key like \"2XX\", or \"default\") -- never re-bucketed. Additive to responseSchema/errorSchema above, never replacing them; contracts/validate.mjs does not read this field. Present only when matched/adopted AND both the response and error union projections resolved cleanly (or had nothing to project) for this operation.",
            "type": "object",
            "propertyNames": { "pattern": "^(?:[1-5](?:[0-9]{2}|XX)|default)$" },
            "additionalProperties": {
              "type": "object",
              "additionalProperties": false,
              "properties": {
                "description": { "type": "string" },
                "schemaFrom": { "enum": ["response", "error"] },
                "schema": { "type": "object" },
                "mediaTypes": { "type": "array", "items": { "type": "string" } }
              }
            }
          },
          "sourceRequestBody": {
            "description": "A8: the request body's non-application/json media types (e.g. multipart/form-data), copied from a real source document. `content` never carries an \"application/json\" key -- that stays requestBodySchema above, the one representation of that one fact.",
            "type": "object",
            "additionalProperties": false,
            "properties": {
              "required": { "type": "boolean" },
              "content": {
                "type": "object",
                "not": { "required": ["application/json"] },
                "additionalProperties": {
                  "type": "object",
                  "additionalProperties": false,
                  "properties": { "schema": { "type": "object" } }
                }
              }
            }
          },
          "pathParamsHeuristic": {
            "description": "A9: names every path-parameter segment in `pathParams` whose schema still came from this contract's own name heuristic (`/id$/i` -> a UUID pattern) rather than a real source document -- because no source document was given, the source declared no schema for that segment, or the schema failed to resolve. Present only when at least one segment is still heuristic-derived; a segment absent from this list was resolved from the source document's own real schema.",
            "type": "array",
            "items": { "type": "string" }
          },
          "expansion": {
            "description": "X2 (D-route-expansion-provenance): present only when this operation's scan endpoint was expanded from a multi-route declaration recognized by the scan adapter (e.g. a future Rails/Laravel-style resource declaration, or a Spring Data REST @RepositoryRestResource) -- omitted for every ordinary 1:1 declared endpoint. `rule` is a namespaced <adapter-id>:<rule-slug> naming the expansion pattern; `declarationLine` is the single source line of the declaration itself (not this operation's own route); `label` is an optional human-readable description, null when not worth composing one.",
            "type": "object",
            "additionalProperties": false,
            "required": ["rule", "declarationLine"],
            "properties": {
              "rule": { "type": "string", "pattern": "^[a-z0-9-]+:[a-z0-9-]+$" },
              "declarationLine": { "type": "integer", "minimum": 1 },
              "label": { "type": ["string", "null"] }
            }
          },
          "sourceDescription": {
            "description": "A10: the operation's `description`, copied verbatim from a real source document. Present only when `contract emit --descriptions` (opt-in, unlike every other source-backed field in this schema) was passed AND the source document declared one for this exact operation AND it did not exceed the length cap.",
            "type": "string"
          }
        }
      }
    },
    "warnings": {
      "description": "A5: structured, not bare strings -- see contracts/completeness.mjs's WARNING_CODES for the known code table.",
      "type": "array",
      "items": {
        "type": "object",
        "additionalProperties": false,
        "required": ["code", "severity", "subject", "message", "detail"],
        "properties": {
          "code": { "type": "string", "pattern": "^CONTRACT_[A-Z_]+$" },
          "severity": { "enum": ["error", "warn"] },
          "subject": { "type": ["string", "null"] },
          "message": { "type": "string" },
          "detail": { "type": "object" }
        }
      }
    },
    "completeness": {
      "description": "A5: derived from operations/warnings alone, independent of any recorded waiver -- see contracts/completeness.mjs's classifyContract().",
      "type": "object",
      "additionalProperties": false,
      "required": ["status", "operation_count", "endpoint_count"],
      "properties": {
        "status": { "enum": ["complete", "partial", "blocked"] },
        "operation_count": { "type": "integer", "minimum": 0 },
        "endpoint_count": { "type": "integer", "minimum": 0 }
      }
    }
  }
}
